{
  "date": "2026-02-23",
  "session_id": "gauntlet_20260223_0830",
  "regime": "elevated",
  "strategy": "C",
  "symbols": [],
  "operator_id": "CSATSPRIM",
  "position_size_multiplier": 0.0,
  "vix_at_analysis": 19.09,
  "vix_source_verified": true,
  "bias": "bearish",
  "expected_behavior": "cash_preservation",
  "key_levels": {},
  "catalysts": [
    "FOMC minutes release",
    "GDP advance estimate",
    "PCE inflation data",
    "Powell congressional testimony",
    "NVDA earnings",
    "AMZN earnings",
    "TSLA earnings",
    "Tariff escalation 15pct from 10pct",
    "Iran military tensions"
  ],
  "earnings_blackout": ["NVDA", "AMZN", "TSLA"],
  "geo_risk": "high",
  "alert_message": "NO-GO — Strategy C deployed — 2026-02-23. VIX 19.09 exceeds Strategy A ceiling of 18. Overnight tariff escalation, Iran tensions, catalyst-dense week (FOMC, GDP, PCE, Powell). CAP-28 affordability block on SPY ATM entries.",
  "entry_window_start": "10:00",
  "entry_window_end": "15:00",
  "vix_gate": {
    "check_time": "09:45",
    "threshold": 18.0
  },
  "max_risk_per_trade": 0.0,
  "max_risk_ceiling": 0.0,
  "data_quality": {
    "quarantine_active": false,
    "stale_fields": [],
    "last_verified": "2026-02-23T08:30:00-05:00",
    "discrepancy_count": 0
  },
  "hard_limits": {
    "max_daily_loss_pct": 0.10,
    "max_single_position": 120,
    "pdt_trades_remaining": 3,
    "force_close_at_dte": 1,
    "weekly_drawdown_governor_active": false,
    "max_weekly_drawdown_pct": 0.15,
    "max_intraday_pivots": 2
  },
  "scorecard": {
    "yesterday_pnl": 0.0,
    "weekly_cumulative_pnl": 0.0,
    "streak": 0
  }
}
