{
  "date": "2026-02-26",
  "session_id": "gauntlet_20260226_0700",
  "regime": "normal",
  "strategy": "A",
  "symbols": ["QQQ"],
  "operator_id": "CSATSPRIM",
  "position_size_multiplier": 0.6,
  "vix_at_analysis": 17.93,
  "vix_source_verified": true,
  "bias": "bullish",
  "expected_behavior": "trending",
  "key_levels": {
    "spy_support": 685.50,
    "spy_resistance": 696.00,
    "spy_pivot": 692.89,
    "qqq_support": 606.03,
    "qqq_resistance": 637.01,
    "qqq_pivot": 616.46
  },
  "catalysts": [
    "Durable Goods Orders 08:30 ET",
    "Initial Jobless Claims 08:30 ET",
    "GDP + PCE tomorrow Feb 27 — positioning risk",
    "NVDA earnings resolved — beat on all metrics"
  ],
  "earnings_blackout": [],
  "geo_risk": "medium",
  "alert_message": "CONDITIONAL GO: First Strategy A deployment. QQQ only. No entry before 10:00 AM ET. Hard VIX ceiling 18.5. Premium verification gate: if no contract within $100, auto-convert to Strategy C. This is a paper trading validation exercise.",
  "data_quality": {
    "quarantine_active": false,
    "stale_fields": ["gex_data", "pre_market_volume", "vix_term_structure"],
    "last_verified": "2026-02-26T07:30:00-05:00",
    "discrepancy_count": 0
  },
  "hard_limits": {
    "max_daily_loss_pct": 0.10,
    "max_single_position": 100,
    "pdt_trades_remaining": 3,
    "force_close_at_dte": 1,
    "weekly_drawdown_governor_active": false,
    "max_weekly_drawdown_pct": 0.15,
    "max_intraday_pivots": 2
  },
  "entry_window_start": "10:00",
  "entry_window_end": "15:30",
  "vix_gate": {
    "check_time": "09:45",
    "threshold": 18.5
  },
  "max_risk_per_trade": 100,
  "max_risk_ceiling": 100,
  "cro_conditions": [
    "No entry before 10:00 AM ET — let Durable Goods settle",
    "QQQ only — SPY unaffordable at current levels",
    "Position size capped at $100 (not $120)",
    "Hard VIX ceiling 18.5 — liquidate if breached",
    "Premium verification gate — no contract within $100 = Strategy C",
    "Paper trading validation exercise — testing affordability boundary"
  ],
  "strategy_parameters": {
    "ema_fast": 8,
    "ema_slow": 21,
    "rsi_min": 50,
    "rsi_max": 65,
    "vwap_condition": "price_above_vwap",
    "take_profit_pct": 0.15,
    "stop_loss_pct": 0.25,
    "time_stop_minutes": 90,
    "min_dte": 2,
    "moneyness": "ATM",
    "entry_window_start": "10:00",
    "entry_window_end": "15:30",
    "vix_ceiling": 18.5,
    "premium_max_usd": 100,
    "premium_gate": "auto_convert_to_C_if_exceeded"
  },
  "scorecard": {
    "yesterday_pnl": 0.00,
    "yesterday_hit_rate": 0.0,
    "regime_accuracy": true,
    "weekly_cumulative_pnl": 0.00,
    "streak": 0
  }
}
