{
  "date": "2026-03-02",
  "session_id": "gauntlet_20260302_0900",
  "regime": "elevated",
  "strategy": "C",
  "symbols": [],
  "operator_id": "CSATSPRIM",
  "position_size_multiplier": 0.0,
  "vix_at_analysis": 21.40,
  "vix_previous_close": 19.86,
  "vix_source_verified": true,
  "bias": "bearish",
  "expected_behavior": "event_driven_crisis",
  "key_levels": {
    "spy_support": 677.25,
    "spy_resistance": 686.50,
    "spy_pivot": 681.75,
    "spy_friday_close": 685.99,
    "spy_premarket": 679.50,
    "qqq_support": 596.00,
    "qqq_resistance": 605.00,
    "qqq_pivot": 600.00,
    "qqq_friday_close": 607.29,
    "qqq_premarket": 599.50
  },
  "catalysts": [
    "US-Israel strikes on Iran — ongoing",
    "Iran supreme leader killed in strikes",
    "Iran retaliatory strikes on US bases in Qatar, Kuwait, UAE, Bahrain",
    "Strait of Hormuz disrupted — vessel traffic sharply reduced",
    "Oil surging — WTI up ~6.5%, Brent up ~8-9%",
    "Gold up ~2% to $5,317 — flight to safety",
    "ISM Manufacturing PMI 10AM ET (prev 52.6)",
    "ISM Manufacturing Prices 10AM ET (prev 59.0)",
    "ISM Services PMI Wednesday",
    "Fed Beige Book Wednesday",
    "Nonfarm Payrolls Friday"
  ],
  "earnings_blackout": [],
  "earnings_watchlist": [
    {"symbol": "COST", "date": "2026-03-05", "impact": "low"}
  ],
  "geo_risk": "high",
  "alert_message": "Strategy C — NO-GO. ACTIVE US-IRAN WAR. VIX 21.4. Cash preservation. Day 1 trading loop validation.",
  "data_quality": {
    "quarantine_active": false,
    "stale_fields": ["gex_data"],
    "advisory_notes": [
      "GEX data unavailable",
      "VIX intraday ~21.4 from futures/live reports",
      "Web search used (Perplexity MCP unavailable)"
    ],
    "last_verified": "2026-03-02T09:30:00-05:00"
  },
  "hard_limits": {
    "max_daily_loss_pct": 0.10,
    "max_single_position": 120,
    "pdt_trades_remaining": 3,
    "force_close_at_dte": 1,
    "weekly_drawdown_governor_active": false,
    "max_intraday_pivots": 2
  },
  "scorecard": {
    "yesterday_pnl": 0.0,
    "yesterday_hit_rate": null,
    "regime_accuracy": null,
    "weekly_cumulative_pnl": 0.0
  },
  "no_go_rationale": {
    "primary": "Active US-Iran military conflict",
    "secondary": "VIX 21.4 above active strategy thresholds",
    "tertiary": "Day 1 trading loop — untested in production",
    "quaternary": "CAP-28 affordability unresolved"
  },
  "reassessment_triggers": [
    "Iran conflict ceasefire or de-escalation",
    "VIX drops below 18 sustained",
    "Strait of Hormuz reopens",
    "Trading loop validated on Strategy C",
    "CAP-28 resolved"
  ]
}
